{
  "schema": "steamcloud.source-artifact/v1",
  "artifact_id": "art_demo",
  "digest": "aaaaaaaaaaaaaaaaaaaaaaaaaaaaaaaaaaaaaaaaaaaaaaaaaaaaaaaaaaaaaaaa",
  "content_type": "application/json",
  "bytes": 128,
  "source_surface": "steam_web_api",
  "auth_method": "webapi_key",
  "scrape_class": "public",
  "subject": "steam:76561198000000000",
  "permit_id": "permit_demo",
  "credential_fingerprint": "bbbbbbbbbbbbbbbbbbbbbbbbbbbbbbbbbbbbbbbbbbbbbbbbbbbbbbbbbbbbbbbb",
  "egress_id": "egress_demo",
  "http_status": 200,
  "observed_at": "2026-08-18T16:00:00Z",
  "object_ref": "r2://source-artifacts/sha256/demo",
  "parser_contract": "steam-player-summaries-v2"
}
